date,title,doi,authors,journal,short_journal,volume,year,publisher,issue,page,abstract
2021-04-01,Digital Technologies for Improving Logistics Performance of Countries,10.2478/ttj-2021-0016,"[{'author_name': 'Aisulu Moldabekova', 'author_slug': 'aisulu-moldabekova-AGkjvv', 'author_sequence_number': '1', 'affiliation': None, 'affiliation_slug': None}, {'author_name': 'Robert Philipp', 'author_slug': 'robert-philipp-ANQQLa', 'author_sequence_number': '2', 'affiliation': None, 'affiliation_slug': None}, {'author_name': 'Hans-Eggert Reimers', 'author_slug': 'hans-eggert-reimers-y861Za', 'author_sequence_number': '3', 'affiliation': None, 'affiliation_slug': None}, {'author_name': 'Bauyrzhan Alikozhayev', 'author_slug': 'bauyrzhan-alikozhayev-Wn5PlQ', 'author_sequence_number': '4', 'affiliation': None, 'affiliation_slug': None}]",Transport and Telecommunication Journal,,22,2021,Walter de Gruyter GmbH,2,207-216,"Abstract
               The logistics performance has a crucial role in the industrial and economic development of countries. This study aims to underline implications for policy makers in improving the logistics performance of countries in terms of Industry 4.0. For this purpose, the effect of digitalisation on logistics performance is analysed by using correlation and multiple regression analysis. The empirical study builds upon dimensions and indicators of the Digital Economy and Society Index (DESI) and Logistics Performance Index (LPI) of the World Bank. The results indicate that governmental policies should target to deliver sound framework conditions for the generation of human capital (here: ICT specialists), sustainable usage of internet services (e.g. professional social networks, online sales, etc.), integration of digital technologies (e.g. Big Data, Cloud computing, etc.), as well as digital connectivity (here: fixed broadband and 4G coverage) in order facilitate improvement of logistics performance."
2023-04-13,Applications of Industry 4.0 Technologies in Warehouse Management: A Systematic Literature Review,10.3390/logistics7020024,"[{'author_name': 'Lihle N. Tikwayo', 'author_slug': 'lihle-n-tikwayo-QWJ4yw', 'author_sequence_number': '1', 'affiliation': None, 'affiliation_slug': None}, {'author_name': 'Tebello Mathaba', 'author_slug': 'tebello-mathaba-EaQlNG', 'author_sequence_number': '2', 'affiliation': None, 'affiliation_slug': None}]",Logistics,Logistics,7,2023,MDPI AG,2,24,"Background: Recent literature indicates that warehouse management costs account for a significant portion of overall logistics costs in companies. Warehousing requires the classification, controlling and management of inventory as well as processing of related information. Therefore, adopting efficient and reasonable warehouse management measures to achieve effective management and control of materials is a key means to flexibly adjusting the supply and demand of storage materials and reduce operating costs. There remains a gap in the understanding of benefits and barriers to the full adoption of Industry 4.0 technologies and decision support systems (DSSs) in warehouse management. Methods: This work applies a systematic literature review methodology of recent implementation case studies to analyze documented barriers and benefits of Industry 4.0 technology adoption in warehouse management. For analysis, benefits and barriers are ranked in order of importance using Pareto analysis based on their frequency of occurrence. Results: Improved process efficiency, the availability of real-time data, added competitive advantage and the ability to integrate business activities digitally are the top four most important benefits of implementing Industry 4.0 technologies and decision support systems in warehouse management. The prominent barriers to implementation are high life cycle cost, challenging physical environment/layout, inadequate supporting resource constraints, increased security risk and high energy consumption. Conclusions: Barriers to implementing Industry 4.0 technologies are interrelated in nature and prevent businesses from realizing the full benefit of implemented Industry 4.0 technologies. Adequate financial support, new knowledge and skills are required to be able to ensure the successful implementation of Industry 4.0 in warehousing management."
2021-09-21,MIDST: an enhanced development environment that improves the maintainability of a data science analysis,10.12821/ijispm080301,"[{'author_name': 'Jeffrey S. Saltz', 'author_slug': 'jeffrey-s-saltz-1Z0DxW', 'author_sequence_number': '1', 'affiliation': None, 'affiliation_slug': None}, {'author_name': 'Kevin Crowston', 'author_slug': 'kevin-crowston-W8lJyn', 'author_sequence_number': '2', 'affiliation': None, 'affiliation_slug': None}, {'author_name': 'Robert Heckman', 'author_slug': 'robert-heckman-G301px', 'author_sequence_number': '3', 'affiliation': None, 'affiliation_slug': None}, {'author_name': 'Yatish Hegde', 'author_slug': 'yatish-hegde-xPQax3', 'author_sequence_number': '4', 'affiliation': None, 'affiliation_slug': None}]",International Journal of Information Systems and Project Management,IJISPM,8,2021,University of Minho,3,5-22,"With the increasing ability to generate actionable insight from data, the field of data science has seen significant growth. As more teams develop data science solutions, the analytical code they develop will need to be enhanced in the future, by an existing or a new team member. Thus, the importance of being able to easily maintain and enhance the code required for an analysis will increase. However, to date, there has been minimal research on the maintainability of an analysis done by a data science team. To help address this gap, data science maintainability was explored by (1) creating a data science maintainability model, (2) creating a new tool, called MIDST (Modular Interactive Data Science Tool), that aims to improve data science maintainability, and then (3) conducting a mixed method experiment to evaluate MIDST. The new tool aims to improve the ability of a team member to update and rerun an existing data science analysis by providing a visual data flow view of the analysis within an integrated code and computational environment. Via an analysis of the quantitative and qualitative survey results, the experiment found that MIDST does help improve the maintainability of an analysis. Thus, this research demonstrates the importance of enhanced tools tohelp improve the maintainability of data science projects."
2019-06-01,Innovative Scheme for Efficient Freight Movement and Sustainable Emissions Management,10.2478/ttj-2019-0020,"[{'author_name': 'Afroditi Anagnostopoulou', 'author_slug': 'afroditi-anagnostopoulou-Pz8ya0', 'author_sequence_number': '1', 'affiliation': None, 'affiliation_slug': None}, {'author_name': 'Evangelia Papargyri', 'author_slug': 'evangelia-papargyri-NlVwG9', 'author_sequence_number': '2', 'affiliation': None, 'affiliation_slug': None}, {'author_name': 'Maria Boile', 'author_slug': 'maria-boile-ZGZrdP', 'author_sequence_number': '3', 'affiliation': None, 'affiliation_slug': None}]",Transport and Telecommunication Journal,,20,2019,Walter de Gruyter GmbH,3,242-250,"Abstract
This paper presents and analyses an innovative integrated scheme that aims to rationalize and improve the efficiency of urban freight transport as well as to promote reduced GHG emissions and traffic flows. Emissions management has become critical concern for modern companies and public authorities seeking to reduce carbon emissions and energy consumption from private and commercial heavy vehicle fleets, in line with the political targets of COP21 to COP23. The proposed scheme aims to utilize the current technological advances for efficient transport and logistics operations that regional authorities and companies can use and afford in order to provide competitive traffic management decisions as well as improvements in terms of pollutant emissions reduction. Both public and private stakeholders could interact to monitor and evaluate the impact of traffic policies and measures over time as well as the level of success of their routing strategies. Computational results on different scenarios of an experimental simulation model illustrate the competitiveness of the proposed scheme in an effort to quantify its effect."
2021-10-01,Measuring the Total Logistics Costs at the Macro Level: A Study of Indonesia,10.3390/logistics5040068,"[{'author_name': 'Sugeng Santoso', 'author_slug': 'sugeng-santoso-bO1yOW', 'author_sequence_number': '1', 'affiliation': None, 'affiliation_slug': None}, {'author_name': 'R. Nurhidayat', 'author_slug': 'r-nurhidayat-EEWQvP', 'author_sequence_number': '2', 'affiliation': None, 'affiliation_slug': None}, {'author_name': 'Gustofan Mahmud', 'author_slug': 'gustofan-mahmud-mAm4L2', 'author_sequence_number': '3', 'affiliation': None, 'affiliation_slug': None}, {'author_name': 'Abdul Mujib Arijuddin', 'author_slug': 'abdul-mujib-arijuddin-gYwe4z', 'author_sequence_number': '4', 'affiliation': None, 'affiliation_slug': None}]",Logistics,Logistics,5,2021,MDPI AG,4,68,"Background: Efforts made to calculate the logistics costs in Indonesia, at the macro level, are facing various problems, due to the fact that there have been no national agreements—to any models employed—to calculate those costs. Moreover, limited data and information due to the lack of use of such integrated information technology to reduce the information asymmetry on the logistics processes and activities have created some additional problems. Objective: This study is aimed at reviewing the measurement model, of the logistics costs used in Indonesia, at the macro level. Method: It provides a potential measurement approach proposed by several previous studies as an alternative option that may help develop the existing models by elaborating on their limitations. Results: The results of this study emphasize the recognition of the components of the logistics costs and the formulation of a more accurate, transparent, and comprehensive measurement framework to improve the standard used to assess the logistics costs. Conclusion: Thus, the calculation output of the logistics costs is expected to be able to provide stakeholders with reliable information to develop an efficient logistics system. Furthermore, logistics costs will be more controllable, allowing Indonesia to achieve such comparative advantages."
2023-05-05,Proactive and reactive engagement of artificial intelligence methods for education: a review,10.3389/frai.2023.1151391,"[{'author_name': 'Sruti Mallik', 'author_slug': 'sruti-mallik-A3jZAL', 'author_sequence_number': '1', 'affiliation': None, 'affiliation_slug': None}, {'author_name': 'Ahana Gangopadhyay', 'author_slug': 'ahana-gangopadhyay-wZyggy', 'author_sequence_number': '2', 'affiliation': None, 'affiliation_slug': None}]",Frontiers in Artificial Intelligence,Front. Artif. Intell.,6,2023,Frontiers Media SA,,,"The education sector has benefited enormously through integrating digital technology driven tools and platforms. In recent years, artificial intelligence based methods are being considered as the next generation of technology that can enhance the experience of education for students, teachers, and administrative staff alike. The concurrent boom of necessary infrastructure, digitized data and general social awareness has propelled these efforts further. In this review article, we investigate how artificial intelligence, machine learning, and deep learning methods are being utilized to support the education process. We do this through the lens of a novel categorization approach. We consider the involvement of AI-driven methods in the education process in its entirety—from students admissions, course scheduling, and content generation in the proactive planning phase to knowledge delivery, performance assessment, and outcome prediction in the reactive execution phase. We outline and analyze the major research directions under proactive and reactive engagement of AI in education using a representative group of 195 original research articles published in the past two decades, i.e., 2003–2022. We discuss the paradigm shifts in the solution approaches proposed, particularly with respect to the choice of data and algorithms used over this time. We further discuss how the COVID-19 pandemic influenced this field of active development and the existing infrastructural challenges and ethical concerns pertaining to global adoption of artificial intelligence for education."
2023-11-01,Routing Optimization with Vehicle–Customer Coordination,10.1287/mnsc.2023.4739,"[{'author_name': 'Wei Zhang', 'author_slug': 'wei-zhang-8JYwx', 'author_sequence_number': '1', 'affiliation': None, 'affiliation_slug': None}, {'author_name': 'Alexandre Jacquillat', 'author_slug': 'alexandre-jacquillat-R50nD5', 'author_sequence_number': '2', 'affiliation': None, 'affiliation_slug': None}, {'author_name': 'Kai Wang', 'author_slug': 'kai-wang-vJ2p6Z', 'author_sequence_number': '3', 'affiliation': None, 'affiliation_slug': None}, {'author_name': 'Shuaian Wang', 'author_slug': 'shuaian-wang-dvJ11G', 'author_sequence_number': '4', 'affiliation': None, 'affiliation_slug': None}]",Management Science,Management Science,69,2023,Institute for Operations Research and the Management Sciences (INFORMS),11,6876-6897,"In several transportation systems, vehicles can choose where to meet customers rather than stopping in fixed locations. This added flexibility, however, requires coordination between vehicles and customers that adds complexity to routing operations. This paper develops scalable algorithms to optimize these operations. First, we solve the one-stop subproblem in the [Formula: see text] space and the [Formula: see text] space by leveraging the geometric structure of operations. Second, to solve a multistop problem, we embed the single-stop optimization into a tailored coordinate descent scheme, which we prove converges to a global optimum. Third, we develop a new algorithm for dial-a-ride problems based on a subpath-based time–space network optimization combining set partitioning and time–space principles. Finally, we propose an online routing algorithm to support real-world ride-sharing operations with vehicle–customer coordination. Computational results show that our algorithm outperforms state-of-the-art benchmarks, yielding far superior solutions in shorter computational times and can support real-time operations in very large-scale systems. From a practical standpoint, most of the benefits of vehicle–customer coordination stem from comprehensively reoptimizing “upstream” operations as opposed to merely adjusting “downstream” stopping locations. Ultimately, vehicle–customer coordination provides win–win–win outcomes: higher profits, better customer service, and smaller environmental footprint.  This paper was accepted by Chung Piaw Teo, optimization.  Funding: This research was supported by the National Natural Science Foundation of China [Grants 72288101, 52221005 and 52220105001].  Supplemental Material: The e-companion and data are available at https://doi.org/10.1287/mnsc.2023.4739 ."
2018-10-18,"Logistics Education and Behavioral Training Decisions, Time Distortion, and the Prae Ante View",10.3390/logistics2040024,"[{'author_name': 'Thomas Neukirchen', 'author_slug': 'thomas-neukirchen-ygkXMx', 'author_sequence_number': '1', 'affiliation': None, 'affiliation_slug': None}, {'author_name': 'Matthias Klumpp', 'author_slug': 'matthias-klumpp-OVE8Ok', 'author_sequence_number': '2', 'affiliation': None, 'affiliation_slug': None}]",Logistics,Logistics,2,2018,MDPI AG,4,24,"In training and education for logistics, time inconsistency affects individual decisions regarding education and career choices. This is especially relevant in view of growing boundarylessness of careers that impacts the logistics sector with its high ratio of lateral entrants. We enrich the analysis of training and education decision-making processes with a third view beyond the common ex ante and ex post perspectives that has not been employed yet in this context. Our insights, modeled as a new prae ante view, can help prevent myopia in educational choice on an individual level and the resulting economic inefficiencies. This translates into more fitting provisions by individuals earlier, and into improved targeting of prospective employees in logistics. The purpose of this study is to provide an agent-based description grounded in behavioral economics, supported by an explorative empirical survey using extensive semi-structured expert-interviews with six participants concerning four to six career transitions each, conducted with employees in logistics professions. Main conclusions include that participants who were asked openly about influential factors for education and career decisions were oblivious of some factors described as highly predictive of educational and career success in literature, not acknowledging social and cultural capital, habitus, and chance, but also consistently ascribing success to a ""milestone-mindset"" to be described here as well.Logistics 2018, 2, 24 2 of 16 specific logistics education and training is beyond dispute [5][6][7], the issue of time-inconsistent choices in that regard has rarely been addressed, which appears especially striking given the high occurrence of track changes leading employees into logistics as lateral entrants [8][9][10]. Time inconsistency is a well-established topic in behavioral economics [11][12][13][14], while basic or continuing education and training are discussed in research in many contexts including our instance regarding the context of time-inconsistent educational choice in logistics.In our approach, all levels of education and training in logistics (vocational, academic, and continuing) are involved [15,16]. In this contribution, three perspectives are discerned, two of which are commonplace in economic theory. Usually, economic theory describes a decision perspective from an ex ante and ex post view. We deem this an unjustified limitation and propose an extended framework including a new ""prae ante"" view, for which this paper provides qualitative insights into the influential factors for this additional analytical perspective. Educational and career choices can be seen as investments in one's own human capital and are often analyzed both strategically (ex ante) and evaluated (ex post). In the economic analysis of intertemporal investment decisions, ex ante concerns the decision given the preferences, expectations, and information on the future [17,18]; meanwhile, ex post concerns an evaluation of decision outcomes in hindsight, for instance, by a..."
2023-12-01,Exploring Applications and Practical Examples by Streamlining Material Requirements Planning (MRP) with Python,10.3390/logistics7040091,"[{'author_name': 'João Reis', 'author_slug': 'João Reis', 'author_sequence_number': None, 'affiliation': None, 'affiliation_slug': None}]",Logistics,Logistics,7,2023,MDPI AG,4,91,"Background: Material Requirements Planning (MRP) is critical in Supply Chain Management (SCM), facilitating effective inventory management and meeting production demands in the manufacturing sector. Despite the potential benefits of automating the MRP tasks to meet the demand for expedited and efficient management, the field appears to be lagging behind in harnessing the advancements offered by Artificial Intelligence (AI) and sophisticated programming languages. Consequently, this study aims to address this gap by exploring the applications of Python in simplifying the MRP processes. Methods: This article offers a twofold approach: firstly, it conducts research to uncover the potential applications of the Python code in streamlining the MRP operations, and the practical examples serve as evidence of Python’s efficacy in simplifying the MRP tasks; secondly, this article introduces a conceptual framework that showcases the Python ecosystem, highlighting libraries and structures that enable efficient data manipulation, analysis, and optimization techniques. Results: This study presents a versatile framework that integrates a variety of Python tools, including but not limited to Pandas, Matplotlib, and Plotly, to streamline and actualize an 8-step MRP process. Additionally, it offers preliminary insights into the integration of the Python-based MRP solution (MRP.py) with Enterprise Resource Planning (ERP) systems. Conclusions: While the article focuses on demonstrating the practicality of Python in MRP, future endeavors will entail empirically integrating MRP.py with the ERP systems in small- and medium-sized companies. This integration will establish real-time data synchronization between the Python and ERP systems, leading to accurate MRP calculations and enhanced decision-making processes."
2021-11-17,Sustainable Supply Chain Management in the Route for a Circular Economy: An Integrative Literature Review,10.3390/logistics5040081,"[{'author_name': 'Jorge Alfredo Cerqueira Streit', 'author_slug': 'jorge-alfredo-cerqueira-streit-6nPk5g', 'author_sequence_number': '1', 'affiliation': None, 'affiliation_slug': None}, {'author_name': 'Gustavo Yuho Endo', 'author_slug': 'gustavo-yuho-endo-DRVZVd', 'author_sequence_number': '2', 'affiliation': None, 'affiliation_slug': None}, {'author_name': 'Patrícia Guarnieri', 'author_slug': 'patricia-guarnieri-g1105A', 'author_sequence_number': '3', 'affiliation': None, 'affiliation_slug': None}, {'author_name': 'Luciano Batista', 'author_slug': 'luciano-batista-gZOZZJ', 'author_sequence_number': '4', 'affiliation': None, 'affiliation_slug': None}]",Logistics,Logistics,5,2021,MDPI AG,4,81,"Sustainable supply chain management (SSCM) considers social, environmental, and economic dimensions of sustainability. In the context of the pandemic, organizations must face consequences striking the wider dimensions of sustainability. Thus, after the COVID-19 pandemic, how will the value chains collaborate for the transition from a traditional (linear) to a Circular Economy? From this question, in this paper, we analyze the international papers that connect sustainable supply chain management (SSCM) with circular economy (CE). We conducted an Integrative Literature Review based on the Web of Science and Scopus databases from 2010 to 2020, using the Methodi Ordinatio protocol to classify the papers. The 37 best-ranked papers were analyzed thoroughly. The results show the prominent authors, institutions, the network relationship between authors, the evolution of publications, and the leading journals. The content of these articles was categorized and discussed about the changes in the way products are manufactured, distributed, consumed, and recovered. The integration of CE principles in SSCM has been evaluated as having potential utility for industries, cities, and businesses in general. Finally, an agenda was identified with suggestions for further research, which can aid researchers and practitioners acting in this field. Managers can obtain insights to improve supply chain sustainability and consequently respond to the challenges imposed by the current pandemic."
2023-09-13,Transformative Procurement Trends: Integrating Industry 4.0 Technologies for Enhanced Procurement Processes,10.3390/logistics7030063,"[{'author_name': 'Areej Althabatah', 'author_slug': 'Areej Althabatah', 'author_sequence_number': None, 'affiliation': None, 'affiliation_slug': None}]",Logistics,Logistics,7,2023,MDPI AG,3,63,"Background: the advent of Industry 4.0 (I4.0) innovations has revolutionized supply chain management through technologies like the Internet of Things (IoT) and Artificial Intelligence (AI) integrated into procurement processes. Methods: this study addresses a critical knowledge gap by conducting a comprehensive review of 111 papers sourced from the Scopus database. These papers are classified into seven sub-themes encompassing I4.0 or procurement 4.0 (P4.0), big data, IoT, additive manufacturing, blockchain, e-procurement, and AI. Results: the investigation reveals that I4.0 technologies, particularly e-procurement and blockchain, have garnered substantial attention. Such technologies offer diverse value propositions, encompassing streamlined supplier evaluation, lead time reduction, cost optimization, and enhanced data security. Conclusion: the paper underscores pivotal trends and insights for the evolution of Procurement 4.0, illuminating a path toward more efficient supply chain management."
