date,title,doi,authors,journal,short_journal,volume,year,publisher,issue,page,abstract
2023-02-26,Guidelines for Renewal and Securitization of a Critical Infrastructure Based on IoT Networks,10.3390/smartcities6020035,"[{'author_name': 'Cristina Villar Miguelez', 'author_slug': 'cristina-villar-miguelez-lW9PXv', 'author_sequence_number': '1', 'affiliation': None, 'affiliation_slug': None}, {'author_name': 'Víctor Monzón Baeza', 'author_slug': 'victor-monzon-baeza-e6k9QK', 'author_sequence_number': '2', 'affiliation': None, 'affiliation_slug': None}, {'author_name': 'Raùl Parada', 'author_slug': 'raul-parada-j6RpbM', 'author_sequence_number': '3', 'affiliation': None, 'affiliation_slug': None}, {'author_name': 'Carlos Monzo', 'author_slug': 'carlos-monzo-QylnyM', 'author_sequence_number': '4', 'affiliation': None, 'affiliation_slug': None}]",Smart Cities,Smart Cities,6,2023,MDPI AG,2,728-743,"Global warming has increased uncertainty regarding managing traditional water supply systems. Unfortunately, there is a need for the smart management of water supply systems. This work aims to design a solution for renewing and securing critical infrastructure that supplies water and provides water purification inside the range of applications of Industry 4.0 for Smart Cities. Therefore, we analyze the renewal requirements and the applicable use cases and propose a solution based on IoT networks for critical infrastructure in the urban environment. We describe the architecture of the IoT network and the specific hardware for securing a water supply and wastewater treatment chain. In addition, the water level control process for the supply chain and the system that ensures the optimal level of chemicals for wastewater treatment are detailed. Finally, we present the guidelines for infrastructure operators to carry out this operation within Industry 4.0, constituting a development framework for future research on the design of Smart Cities."
2020-12-01,Network Trust and Trust Behaviors Among Executives in Supply Chain Interactions,10.1287/mnsc.2019.3499,"[{'author_name': 'Emily W. Choi', 'author_slug': 'emily-w-choi-ay2PP9', 'author_sequence_number': '1', 'affiliation': None, 'affiliation_slug': None}, {'author_name': 'Özalp Özer', 'author_slug': 'ozalp-ozer-A3rWda', 'author_sequence_number': '2', 'affiliation': None, 'affiliation_slug': None}, {'author_name': 'Yanchong Zheng', 'author_slug': 'yanchong-zheng-xQyPxJ', 'author_sequence_number': '3', 'affiliation': None, 'affiliation_slug': None}]",Management Science,Management Science,66,2020,Institute for Operations Research and the Management Sciences (INFORMS),12,5823-5849,"We integrate the results of a social network survey and a forecast information sharing experiment to examine the roles of trust and trustworthiness in impacting high-ranking executives’ decisions in supply chain interactions. The members of our executive sample have, on average, 17 years of work experience. A significant portion of them holds positions at the C-level in world-leading organizations that span a wide range of industries. By examining the roles of trust and trustworthiness in the decision making of high-ranking executives, we find strong external validation for as well as demonstrate how these nonpecuniary, behavioral factors impact the outcomes of business interactions. We employ a multimethod research design that allows us to investigate the extent to which the executives’ trust beliefs toward a relevant network of exchange partners (which we define as their “network trust”) impact their trust behaviors when engaging in business interactions with members of this network. We determine the conditions pertaining to the executives’ professional experiences that strengthen or weaken the impact of network trust on the executives’ trust behaviors in supply chain interactions. For example, executives with more diverse professional experiences rely more on network trust to shape their trust behaviors. Conversely, executives with prior positive trust experiences rely less on network trust in their trusting behaviors. We quantify that improved trust and trustworthiness can yield up to 41%, 6%, and 5% gain in the expected profit of the supplier, the retailer, and the supply chain. Our results offer tangible implications for how organizations can better leverage executives’ knowledge about how much to rely on network trust in business interactions to achieve better outcomes.  This paper was accepted by Serguei Netessine, operations management."
2023-07-17,Systematic Literature Review in Reshoring Strategies 4.0,10.3390/logistics7030042,"[{'author_name': 'Daniel Masini Espíndola', 'author_slug': 'daniel-masini-espindola-ZnyPM9', 'author_sequence_number': '1', 'affiliation': None, 'affiliation_slug': None}, {'author_name': 'Márcio Lopes Pimenta', 'author_slug': 'marcio-lopes-pimenta-ngQKgD', 'author_sequence_number': '2', 'affiliation': None, 'affiliation_slug': None}, {'author_name': 'Cláudio Heleno Pinto da Silva', 'author_slug': 'claudio-heleno-pinto-da-silva-RjKv9M', 'author_sequence_number': '3', 'affiliation': None, 'affiliation_slug': None}, {'author_name': 'Ingridi Vargas Bortolaso', 'author_slug': 'ingridi-vargas-bortolaso-Wnl1rO', 'author_sequence_number': '4', 'affiliation': None, 'affiliation_slug': None}]",Logistics,Logistics,7,2023,MDPI AG,3,42,"Background: With global changes in markets and government regulations, most organizations, which previously opted for offshore production, began to return to their country of origin—a process called reshoring. The new strategies for locating units and business models, which involve decisions to outsource production and organizational capacity, now face a new context of Industry 4.0, a market for technologies with the potential to transform entire supply chains in addition to directly influencing organizational aspects with innovative solutions and resource efficiency. Methods: This systematic literature review (SLR) found 43 articles relating to reshoring and Industry 4.0; there was an increase in publications in the last few years. We divided the studies according to 9 aspects: market uncertainties and labor supply; support for managerial decision making; competitive priorities analysis (costs and efficiency); business strategies; information knowledge and collaboration management; political, social and economic changes; risk security and privacy management; supply chain management; and investment market and private equity funds. Results: This article presents a content analysis of articles in the field of administration, focusing on location strategies, technology adoption, and organizational changes. The study identifies key aspects such as research quality, publication trends, regional focus, and strategy topics. The findings emphasize the importance of research objectives and problem-solving for managerial decision-making and highlight the need for further exploration in the literature. Conclusions: Reshoring, Industry 4.0, and location strategies are relevant topics for global management. The supply chain plays a role in decision-making for location and technology adoption, suggesting the need for more research in supply chain management."
2023-09-13,Transformative Procurement Trends: Integrating Industry 4.0 Technologies for Enhanced Procurement Processes,10.3390/logistics7030063,"[{'author_name': 'Areej Althabatah', 'author_slug': 'Areej Althabatah', 'author_sequence_number': None, 'affiliation': None, 'affiliation_slug': None}]",Logistics,Logistics,7,2023,MDPI AG,3,63,"Background: the advent of Industry 4.0 (I4.0) innovations has revolutionized supply chain management through technologies like the Internet of Things (IoT) and Artificial Intelligence (AI) integrated into procurement processes. Methods: this study addresses a critical knowledge gap by conducting a comprehensive review of 111 papers sourced from the Scopus database. These papers are classified into seven sub-themes encompassing I4.0 or procurement 4.0 (P4.0), big data, IoT, additive manufacturing, blockchain, e-procurement, and AI. Results: the investigation reveals that I4.0 technologies, particularly e-procurement and blockchain, have garnered substantial attention. Such technologies offer diverse value propositions, encompassing streamlined supplier evaluation, lead time reduction, cost optimization, and enhanced data security. Conclusion: the paper underscores pivotal trends and insights for the evolution of Procurement 4.0, illuminating a path toward more efficient supply chain management."
2022-11-11,Challenges to Promoting Resilience in Supply Chains Observed during the COVID-19 Pandemic: An Exploratory Study of the Amazon Region Using the TOPSIS Technique,10.3390/logistics6040078,"[{'author_name': 'Dhiordan Cunha Tadaiesky', 'author_slug': 'dhiordan-cunha-tadaiesky-3nk64Z', 'author_sequence_number': '1', 'affiliation': None, 'affiliation_slug': None}, {'author_name': 'Joaquim Lima das Neves Neto', 'author_slug': 'joaquim-lima-das-neves-neto-bMRrvk', 'author_sequence_number': '2', 'affiliation': None, 'affiliation_slug': None}, {'author_name': 'André Cristiano Silva Melo', 'author_slug': 'andre-cristiano-silva-melo-Wn8x0M', 'author_sequence_number': '3', 'affiliation': None, 'affiliation_slug': None}, {'author_name': 'Rosley Anholon', 'author_slug': 'rosley-anholon-1vyKM', 'author_sequence_number': '4', 'affiliation': None, 'affiliation_slug': None}, {'author_name': 'Eliane de Castro Coutinho', 'author_slug': 'eliane-de-castro-coutinho-xGGyOb', 'author_sequence_number': '5', 'affiliation': None, 'affiliation_slug': None}, {'author_name': 'Vitor William Batista Martins', 'author_slug': 'vitor-william-batista-martins-bOJXNW', 'author_sequence_number': '6', 'affiliation': None, 'affiliation_slug': None}]",Logistics,Logistics,6,2022,MDPI AG,4,78,"Background: The COVID-19 pandemic has moved the world in every way, directly impacting supply chains globally and bringing major challenges to management, decision-makers, and companies of all sizes and sectors. This intensifies when it comes to the Brazilian Amazon region, a place that historically already lives with several maintenance projects focused on supply chain management (SCM). Methods: Thus, this research aimed to understand the main challenges faced by professionals in the supply chain area in the Amazon region through the development of a survey with professionals in the area. This study conducted a structured questionnaire containing 10 challenges related to SCM during the pandemic period to generate a ranking of these challenges using data analysis using means and comparative ordering using the TOPSIS Multicriteria Technique. Results: It was observed that the most relevant challenges for companies in this region were, respectively, distribution, economic problems, and interruptions in supply and demand. These obstacles promote debates with the literature and foster the expansion of knowledge about the insertion of resilience elements in supply chains in the Amazon. Conclusions: From a theoretical point of view and because it is exploratory research, the results serve as a basis for researchers in the area who aim to understand and expand the debates on this topic through future research. From a practical point of view, the results can help supply chain managers in the Amazon region who work directly in its maintenance and aim to maintain its resilience, since they already have the main challenges for the proper functioning of supply chains identified and ranked. Because it is an exploratory study, the results achieved can contribute significantly to the expansion of debates in the area and in a practical way with managers involved in activities that compose supply chains."
2021-07-05,"Disorders, Vulnerabilities and Resilience in the Supply Chain in Pandemic Times",10.3390/logistics5030048,"[{'author_name': 'Catarina Ferreira', 'author_slug': 'catarina-ferreira-JWAGR6', 'author_sequence_number': '1', 'affiliation': None, 'affiliation_slug': None}, {'author_name': 'Catarina Cardoso', 'author_slug': 'catarina-cardoso-R53Yw4', 'author_sequence_number': '2', 'affiliation': None, 'affiliation_slug': None}, {'author_name': 'Mariana Travassos', 'author_slug': 'mariana-travassos-XgMaMD', 'author_sequence_number': '3', 'affiliation': None, 'affiliation_slug': None}, {'author_name': 'Mariana Ferreira de S. M. Paiva', 'author_slug': 'mariana-ferreira-de-s-m-GPeMW6', 'author_sequence_number': '4', 'affiliation': None, 'affiliation_slug': None}, {'author_name': 'M.L. Pestana', 'author_slug': 'm-l-pestana-9grgrG', 'author_sequence_number': '5', 'affiliation': None, 'affiliation_slug': None}, {'author_name': 'João M. Lopes', 'author_slug': 'joao-m-lopes-8gV26Q', 'author_sequence_number': '6', 'affiliation': None, 'affiliation_slug': None}, {'author_name': 'Márcio Oliveira', 'author_slug': 'marcio-oliveira-R5O4m4', 'author_sequence_number': '7', 'affiliation': None, 'affiliation_slug': None}]",Logistics,Logistics,5,2021,MDPI AG,3,48,"The economic and social environment caused by the COVID-19 pandemic has brought additional pressure on supply chains because they now have more pressure to develop and adapt to a context of economic constraint. Delays in the supply chain can bring consequences such as the lack of food products by retailers, transporters and manufacturers. Thus, this study aims to examine the supply chain during the COVID-19 pandemic in small- and medium-sized food companies in the central region of Portugal, identifying potential problems and pointing out the respective solutions. For this purpose, the study uses a qualitative methodology through semi-structured interviews. It was found that small and medium-sized enterprises (SMEs) do not have a codified supply chain and that generally, these companies have a minimal budget, which requires a constant search for new suppliers that represent a reduction in costs. Moreover, most of the companies surveyed faced unexpected challenges, such as a lack of alternative suppliers. The present paper is original because it studies the supply chain in SMEs in the food sector during the COVID-19 pandemic, and it allows the ascertainment of practical suggestions for these companies to improve, as well as contributing to the clarification of the literature on the supply chain in times of crisis such as the current COVID-19 pandemic."
2020-01-01,COVID-19 impact on sustainable production and operations management,10.1016/j.susoc.2020.06.001,"[{'author_name': 'Aalok Kumar', 'author_slug': 'aalok-kumar-G5OLAK', 'author_sequence_number': '1', 'affiliation': None, 'affiliation_slug': None}, {'author_name': 'Sunil Luthra', 'author_slug': 'sunil-luthra-r6lkM6', 'author_sequence_number': '2', 'affiliation': None, 'affiliation_slug': None}, {'author_name': 'Sachin Kumar Mangla', 'author_slug': 'sachin-kumar-mangla-pn1LpN', 'author_sequence_number': '3', 'affiliation': None, 'affiliation_slug': None}, {'author_name': 'Yiğit Kazançoğlu', 'author_slug': 'yigit-kazancoglu-K6Zvm5', 'author_sequence_number': '4', 'affiliation': None, 'affiliation_slug': None}]",Sustainable Operations and Computers,Sustainable Operations and Computers,1,2020,Elsevier BV,,1-7,"The global production and supply chain system is mostly disrupted due to widespread of the coronavirus pandemic (COVID-19). Most of the industrial managers and policymakers are searching for adequate strategies and policies for revamping production patterns and meet consumer demand. Form global supply chain perspectives, the majority of raw materials are imported from China and other Asian developing nations. The COVID-19 pandemic has broken the most of transportation links and distribution mechanisms between suppliers, production facilities and customers. Therefore, it is imperative to discuss sustainable production and consumption pattern in the post-COVID-19 pandemic era. Most of the prominent economies around the world enforced a total lockdown, and the focus has since shifted to surge in demand for essential products and services. This has led to a decline in demand for some nonessential products and services. The production and operations management challenges of the pandemic situations are discussed and adequately proposes policy strategies for improving the resilience and sustainability of the system. This paper also discusses the different operations and supply chain perspectives for handling such disruptions in the future."
2023-11-01,Optimizing Algerian Company’s Delivery Fleet with Agent_Based Model in Anylogic,10.2478/ttj-2023-0034,"[{'author_name': 'Nassima Bounadi', 'author_slug': 'Nassima Bounadi', 'author_sequence_number': None, 'affiliation': None, 'affiliation_slug': None}]",Transport and Telecommunication Journal,,24,2023,Walter de Gruyter GmbH,4,434-442,"Abstract
               The utilization of simulation modelling in supply chain management has proven to be a valuable tool for logistics service providers, enabling them to optimize their operations and meet customer demands efficiently. AnyLogic, with its diverse capabilities in discrete event simulation, system dynamics, and agent-based simulation, stands out as a powerful software solution for tackling complex supply chain challenges. This paper significantly contributes by demonstrating the practical implementation of AnyLogic in the modelling and simulation of agro-food product distribution network, particularly vegetable oils from the Cevital group. Additionally, the study integrates an optimization experiment to ascertain the optimal number of vehicles required to meet a specific customer demand while ensuring a high level of fleet utilization. The obtained results are very encouraging and demonstrate the feasibility and effectiveness of our approach."
2023-12-27,Information systems project management practice in Portugal - looking at the past to perspective the future,10.12821/ijispm110404,"[{'author_name': 'Nilton Takagi', 'author_slug': 'Nilton Takagi', 'author_sequence_number': None, 'affiliation': None, 'affiliation_slug': None}]",International Journal of Information Systems and Project Management,IJISPM,11,2023,University of Minho,4,103-121,"The study of Information Systems Project Management (ISPM) practice is fundamental for developing knowledge in this field. Over the past few years, several studies have been conducted in organizations by professionals and academics to identify approaches, processes, tools, and techniques, among other relevant aspects of project management practice. The use of these practices can be related to various factors, such as trends in the world of work or even the cultural context. In this way, an insight into the context of a given region can support actions to improve ISPM practice and raise success rates in information systems projects. This paper presents the results of a systematic literature review that seeks to synthesize how project management on information systems is practiced in Portugal and identify opportunities for developing the project management body of knowledge."
2022-02-02,A System View to the Risks of COVID-19 Vaccination Projects,10.3390/asi5010020,"[{'author_name': 'Shahryar Sorooshian', 'author_slug': 'shahryar-sorooshian-ZGKeYp', 'author_sequence_number': '1', 'affiliation': None, 'affiliation_slug': None}, {'author_name': 'Afshin Abbaspour', 'author_slug': 'afshin-abbaspour-ZZK5y', 'author_sequence_number': '2', 'affiliation': None, 'affiliation_slug': None}, {'author_name': 'Ali Jahan', 'author_slug': 'ali-jahan-MVkNGE', 'author_sequence_number': '3', 'affiliation': None, 'affiliation_slug': None}]",Applied System Innovation,ASI,5,2022,MDPI AG,1,20,"The global vaccination program provides hope for ending the present worldwide pandemic. Due to the current pandemic, COVID-19 vaccines must be delivered and administered to communities once supplies are available. However, there are significant challenges in the sourcing, allocation, distribution, and uptake of vaccinations. A successful vaccination program would necessitate adequate risk management across the vaccination supply chain. This article has collected the predictable risks of the COVID-19 vaccines considered within the vaccine delivery system framework. The risks are presented based on relevant literature. Hence, this work’s framework is expected to contribute to better risk management of vaccination programs and similar future projects."
2023-01-03,The Impact of Digital Technologies and Sustainable Practices on Circular Supply Chain Management,10.3390/logistics7010001,"[{'author_name': 'Sara Romagnoli', 'author_slug': 'sara-romagnoli-nGGr4', 'author_sequence_number': '1', 'affiliation': None, 'affiliation_slug': None}, {'author_name': ""Claudia Tarabu'"", 'author_slug': 'claudia-tarabu-ezpmp', 'author_sequence_number': '2', 'affiliation': None, 'affiliation_slug': None}, {'author_name': 'Behzad Maleki Vishkaei', 'author_slug': 'behzad-maleki-vishkaei-6JnYwM', 'author_sequence_number': '3', 'affiliation': None, 'affiliation_slug': None}, {'author_name': 'Pietro De Giovanni', 'author_slug': 'pietro-de-giovanni-PQ9aE2', 'author_sequence_number': '4', 'affiliation': None, 'affiliation_slug': None}]",Logistics,Logistics,7,2023,MDPI AG,1,1,"Background: This study investigates how firms can enhance the functionality of their circular supply chains (CSCs) by adopting a portfolio of sustainable practices as well as digital technologies to increase performance. It analyzes the benefits that firms can obtain when investing in specific technologies to boost the impact of technologies and sustainable practices on CSCs, and further increase performance. Methods: We test several hypotheses by using structural equation modeling as well as multi-group analysis to verify whether CSCs can be achieved through sustainable practices and technologies and improve the firms’ performance. Results: The empirical results partially support the research hypotheses. While the main research hypotheses are fully supported, the analysis of single digital technologies reveals that only a few solutions can contribute to both the management and the improvement of the CSC. Conclusions: Our findings demonstrate that the identification of green suppliers and ad hoc environmental regulations, combined with attention to the origin and provenance of raw materials, can promote a CSC. Moreover, transportation management systems (TMS) and the internet of things (IoT) are efficient technologies for managing transportation and product flow in the CSC. Furthermore, machine learning (ML) is effective in making positive green decisions, and 3D printing can extend product life."
2018-08-30,Logistics Services Sector and Economic Recession in Greece: Challenges and Opportunities,10.3390/logistics2030016,"[{'author_name': 'Dimitris Folinas', 'author_slug': 'dimitris-folinas-1gZ29X', 'author_sequence_number': '1', 'affiliation': None, 'affiliation_slug': None}, {'author_name': 'Naoum Tsolakis', 'author_slug': 'naoum-tsolakis-2NKblm', 'author_sequence_number': '2', 'affiliation': None, 'affiliation_slug': None}, {'author_name': 'Dimitrios Aidonis', 'author_slug': 'dimitrios-aidonis-1ggwEX', 'author_sequence_number': '3', 'affiliation': None, 'affiliation_slug': None}]",Logistics,Logistics,2,2018,MDPI AG,3,16,"Abstract:The recent economic recession in Greece has had a detrimental impact on all national business activities, with the logistics industry being one of the most affected sectors primarily due to the significant decrease in market demand for goods and services. In this regard, the aim of this research is to identify key challenges and prospects for the Greek logistics services industry stemming from the recent economic crisis era through a critical literature taxonomy, a semantic analysis of the reviewed articles, and a questionnaire-based survey involving 140 executives from the third-party logistics sector. In principal, the recent economic crisis is reported to have significantly affected logistics service providers, thus further imposing structural reforms in the industry. The reduction in operating profits of transport companies is noticeable with the onset of the economic crisis, specifically in 2016. Nevertheless, logistics executives are optimistic regarding the near future, provided that educated and informed strategic management decisions are made and inventive business practices are embraced."
