date,title,doi,authors,journal,short_journal,volume,year,publisher,issue,page,abstract
2023-11-01,Optimizing Algerian Company’s Delivery Fleet with Agent_Based Model in Anylogic,10.2478/ttj-2023-0034,"[{'author_name': 'Nassima Bounadi', 'author_slug': 'Nassima Bounadi', 'author_sequence_number': None, 'affiliation': None, 'affiliation_slug': None}]",Transport and Telecommunication Journal,,24,2023,Walter de Gruyter GmbH,4,434-442,"Abstract
               The utilization of simulation modelling in supply chain management has proven to be a valuable tool for logistics service providers, enabling them to optimize their operations and meet customer demands efficiently. AnyLogic, with its diverse capabilities in discrete event simulation, system dynamics, and agent-based simulation, stands out as a powerful software solution for tackling complex supply chain challenges. This paper significantly contributes by demonstrating the practical implementation of AnyLogic in the modelling and simulation of agro-food product distribution network, particularly vegetable oils from the Cevital group. Additionally, the study integrates an optimization experiment to ascertain the optimal number of vehicles required to meet a specific customer demand while ensuring a high level of fleet utilization. The obtained results are very encouraging and demonstrate the feasibility and effectiveness of our approach."
2021-09-08,A Systematic Investigation of the Integration of Machine Learning into Supply Chain Risk Management,10.3390/logistics5030062,"[{'author_name': 'Meike Schroeder', 'author_slug': 'meike-schroeder-KlX9ee', 'author_sequence_number': '1', 'affiliation': None, 'affiliation_slug': None}, {'author_name': 'Sebastian Lodemann', 'author_slug': 'sebastian-lodemann-Wny6bN', 'author_sequence_number': '2', 'affiliation': None, 'affiliation_slug': None}]",Logistics,Logistics,5,2021,MDPI AG,3,62,"The main objective of the paper is to analyze and synthesize existing scientific literature related to supply chain areas where machine learning (ML) has already been implemented within the supply chain risk management (SCRM) field, both in theory and in practice. Furthermore, we analyzed which risks were addressed in the use cases as well as how ML might shape SCRM. For this purpose, we conducted a systematic literature review. The results showed that the applied examples relate primarily to the early identification of production, transport, and supply risks in order to counteract potential supply chain problems quickly. Through the analyzed case studies, we were able to identify the added value that ML integration can bring to the SCRM (e.g., the integration of new data sources such as social media or weather data). From the systematic literature analysis results, we developed four propositions, which can be used as motivation for further research."
2022-02-18,Business alignment in the procurement domain: a study of antecedents and determinants of supply chain performance,10.12821/ijispm020103,"[{'author_name': 'Patrick Mikalef', 'author_slug': 'patrick-mikalef-MVvx8p', 'author_sequence_number': '1', 'affiliation': None, 'affiliation_slug': None}, {'author_name': 'Adamantia G. Pateli', 'author_slug': 'adamantia-g-pateli-68G6jE', 'author_sequence_number': '2', 'affiliation': None, 'affiliation_slug': None}, {'author_name': 'Ronald Batenburg', 'author_slug': 'ronald-batenburg-RV4rr4', 'author_sequence_number': '3', 'affiliation': None, 'affiliation_slug': None}, {'author_name': 'Rogier van de Wetering', 'author_slug': 'rogier-van-de-wetering-zb1Dy8', 'author_sequence_number': '4', 'affiliation': None, 'affiliation_slug': None}]",International Journal of Information Systems and Project Management,IJISPM,2,2022,University of Minho,1,43-59,"With organizations now placing an increasing amount on attention on the management of their supply chain activities, the role of Information Technology (IT) in supporting these operations has been put in the spotlight. In spite of extensive research examining how IT can be employed in various activities of supply chain management, the majority of studies are limited in identifying enablers and inhibitors of adoption. Empirical studies examining post-adoption conditions that facilitate performance improvement still remain scarce. In this study we focus on procurement as part of the supply chain management activities. We apply the business-IT alignment perspective to the domain of procurement, and examine how certain organizational factors impact the attainment of this state. Additionally, we research the effect that procurement alignment has on supply chain management performance. In order to do so, we apply Partial Least Squares (PLS) analysis on a sample of 172 European companies. We find that firms that opt for a centralized governance structure, as well as larger firms, are more likely to attain a state of procurement alignment. Furthermore, our results empirically support the statement that procurement alignment is positively correlated with operational efficiency and competitive performance of the supply chain."
2021-11-17,Sustainable Supply Chain Management in the Route for a Circular Economy: An Integrative Literature Review,10.3390/logistics5040081,"[{'author_name': 'Jorge Alfredo Cerqueira Streit', 'author_slug': 'jorge-alfredo-cerqueira-streit-6nPk5g', 'author_sequence_number': '1', 'affiliation': None, 'affiliation_slug': None}, {'author_name': 'Gustavo Yuho Endo', 'author_slug': 'gustavo-yuho-endo-DRVZVd', 'author_sequence_number': '2', 'affiliation': None, 'affiliation_slug': None}, {'author_name': 'Patrícia Guarnieri', 'author_slug': 'patricia-guarnieri-g1105A', 'author_sequence_number': '3', 'affiliation': None, 'affiliation_slug': None}, {'author_name': 'Luciano Batista', 'author_slug': 'luciano-batista-gZOZZJ', 'author_sequence_number': '4', 'affiliation': None, 'affiliation_slug': None}]",Logistics,Logistics,5,2021,MDPI AG,4,81,"Sustainable supply chain management (SSCM) considers social, environmental, and economic dimensions of sustainability. In the context of the pandemic, organizations must face consequences striking the wider dimensions of sustainability. Thus, after the COVID-19 pandemic, how will the value chains collaborate for the transition from a traditional (linear) to a Circular Economy? From this question, in this paper, we analyze the international papers that connect sustainable supply chain management (SSCM) with circular economy (CE). We conducted an Integrative Literature Review based on the Web of Science and Scopus databases from 2010 to 2020, using the Methodi Ordinatio protocol to classify the papers. The 37 best-ranked papers were analyzed thoroughly. The results show the prominent authors, institutions, the network relationship between authors, the evolution of publications, and the leading journals. The content of these articles was categorized and discussed about the changes in the way products are manufactured, distributed, consumed, and recovered. The integration of CE principles in SSCM has been evaluated as having potential utility for industries, cities, and businesses in general. Finally, an agenda was identified with suggestions for further research, which can aid researchers and practitioners acting in this field. Managers can obtain insights to improve supply chain sustainability and consequently respond to the challenges imposed by the current pandemic."
2022-01-07,A Predictive Maintenance System for Reverse Supply Chain Operations,10.3390/logistics6010004,"[{'author_name': 'Sotiris P. Gayialis', 'author_slug': 'sotiris-p-gayialis-xXEbWw', 'author_sequence_number': '1', 'affiliation': None, 'affiliation_slug': None}, {'author_name': 'Evripidis P. Kechagias', 'author_slug': 'evripidis-p-kechagias-ngkA8d', 'author_sequence_number': '2', 'affiliation': None, 'affiliation_slug': None}, {'author_name': 'Grigorios D. Konstantakopoulos', 'author_slug': 'grigorios-d-konstantakopoulos-8gZ1kG', 'author_sequence_number': '3', 'affiliation': None, 'affiliation_slug': None}, {'author_name': 'Georgios A. Papadopoulos', 'author_slug': 'georgios-a-papadopoulos-R589Qp', 'author_sequence_number': '4', 'affiliation': None, 'affiliation_slug': None}]",Logistics,Logistics,6,2022,MDPI AG,1,4,"Background: Reverse supply chains of machinery and equipment face significant challenges, and overcoming them is critical for effective customer service and sustainable operation. Maintenance and repair services, strongly associated with the reverse movement of equipment, are among the most demanding reverse supply chain operations. Equipment is scattered in various locations, and multiple suppliers are involved in its maintenance, making it challenging to manage the related reverse supply chain operations. Effective maintenance is essential for businesses-owners of the equipment, as reducing costs while improving service quality helps them gain a competitive advantage. Methods: To enhance reverse supply chain operations related to equipment maintenance, this paper presents the operational framework, the methodological approach, and the architecture for developing a system that covers the needs for predictive maintenance in the service supply chain. It is based on Industry 4.0 technologies, such as the Internet of things, machine learning, and cloud computing. Results: As a result of the successful implementation of the system, effective equipment maintenance and service supply chain management is achieved supporting the reverse supply chain. Conclusions: This will eventually lead to fewer good-conditioned spare part replacements, just in time replacements, extended equipment life cycles, and fewer unnecessary disposals."
2020-12-01,Supply Chain Competition: A Market Game Approach,10.1287/mnsc.2019.3511,"[{'author_name': 'C. Gizem Korpeoglu', 'author_slug': 'c-gizem-korpeoglu-1gG1en', 'author_sequence_number': '1', 'affiliation': None, 'affiliation_slug': None}, {'author_name': 'Ersin Körpeoğlu', 'author_slug': 'ersin-korpeoglu-zb3y8Y', 'author_sequence_number': '2', 'affiliation': None, 'affiliation_slug': None}, {'author_name': 'Soo Haeng Cho', 'author_slug': 'soo-haeng-cho-5KXm0D', 'author_sequence_number': '3', 'affiliation': None, 'affiliation_slug': None}]",Management Science,Management Science,66,2020,Institute for Operations Research and the Management Sciences (INFORMS),12,5648-5664,"We study supply chains where multiple suppliers sell to multiple retailers through a wholesale market. In practice, we often observe that both suppliers and retailers tend to influence the wholesale market price that retailers pay to suppliers. However, existing models of supply chain competition do not capture retailers’ influence on the wholesale price (i.e., buyer power) and show that the wholesale price and the order quantity per retailer do not change with the number of retailers. To overcome this limitation, we develop a competition model based on the market game mechanism in which the wholesale price is determined based on both suppliers’ and retailers’ decisions. When taking into account retailers’ buyer power, we obtain the result that is consistent with the observed practice: As the number of retailers increases, each retailer’s buyer power decreases, and each retailer is willing to pay more for her order, so the wholesale price increases. In this case, supply chain expansion to include more retailers (or suppliers) turns out to be more beneficial in terms of supply chain efficiency than what the prior literature shows without considering buyer power. Finally, we analyze the integration of two local supply chains and show that although the profit of the integrated supply chain is greater than the sum of total profits of local supply chains, integration may reduce the total profit of firms in a retailer-oriented supply chain that has more retailers than suppliers.  This paper was accepted by Charles Corbett, operations management."
2022-01-04,Developing Knowledge of Supply Chain Resilience in Less-Developed Countries in the Pandemic Age,10.3390/logistics6010003,"[{'author_name': 'João M. Lopes', 'author_slug': 'joao-m-lopes-8gV26Q', 'author_sequence_number': '1', 'affiliation': None, 'affiliation_slug': None}, {'author_name': 'Sofia Gomes', 'author_slug': 'sofia-gomes-PzmMwk', 'author_sequence_number': '2', 'affiliation': None, 'affiliation_slug': None}, {'author_name': 'Lassana Mané', 'author_slug': 'lassana-mane-3NGL8b', 'author_sequence_number': '3', 'affiliation': None, 'affiliation_slug': None}]",Logistics,Logistics,6,2022,MDPI AG,1,3,"The constraints imposed by the pandemic COVID-19 increased the risks of the disruption of supply chains, bringing new challenges to companies. These effects were felt more intensely in less-developed countries, which are highly dependent on imports of products and raw materials. This study aims to assess the impact of supply chain resilience in a less-developed country (Guinea-Bissau) using complex adaptive system theory. We used a qualitative methodology through multiple case studies. Semi-structured interviews were conducted with four companies. The semi-structured script contains questions about supply chain disruptions, vulnerabilities and resilience. The main results show that the companies in Guinea-Bissau, due to their dependence on the outside world and the absence of formal, larger and more diversified supply chains, suffered serious consequences with the disruption imposed by the pandemic. It was also concluded that the more resilient the supply chain, the fewer the impacts of crisis events and that the resilience of companies at this level depends on their obtaining competitive advantages over their competitors. The main practical implications of this study are the need to formalize the supply chain, diversify the supply of services and products of companies dependent on the exterior, adopt metrics that allow for the early detection of situations of supply chain disruption, effectively manage stocks and promote proactive crisis resolution strategies. Studies on the impact of resilience on supply chains in crises are scarce, especially on companies located in underdeveloped countries."
2021-10-07,Blockchain Technologies in Logistics and Supply Chain Management: A Bibliometric Review,10.3390/logistics5040072,"[{'author_name': 'Abderahman Rejeb', 'author_slug': 'abderahman-rejeb-0Gn8ZP', 'author_sequence_number': '1', 'affiliation': None, 'affiliation_slug': None}, {'author_name': 'Karim Rejeb', 'author_slug': 'karim-rejeb-lXXPly', 'author_sequence_number': '2', 'affiliation': None, 'affiliation_slug': None}, {'author_name': 'Steve Simske', 'author_slug': 'steve-simske-XePAEk', 'author_sequence_number': '3', 'affiliation': None, 'affiliation_slug': None}, {'author_name': 'Horst Treiblmaier', 'author_slug': 'horst-treiblmaier-y8dj4G', 'author_sequence_number': '4', 'affiliation': None, 'affiliation_slug': None}]",Logistics,Logistics,5,2021,MDPI AG,4,72,"The emergence of blockchain technology has sparked significant attention from the supply chain management (SCM) and logistics communities. In this paper, we present the results from a thorough bibliometric review that analytically and objectively identifies the intellectual structure of this field, the seminal papers, and the most influential scholars. We employ a knowledge domain visualization technique to generate insights that go beyond other review studies on blockchain research within logistics and SCM. The analysis starts with selecting a total of 628 papers from Scopus and the Web of Science that were published during 2016–2020. The bibliometric analysis output demonstrates that the number of blockchain papers has rapidly increased since 2017. The most productive researchers are from the USA, China, and India. The top academic institutions contributing to the literature are also identified. Based on network analyses, we found that the literature concentrates mainly on the conceptualization of blockchain; its potentials for supply chain sustainability; its adoption triggers and barriers; and its role in supporting supply chain agility, trust, protection of intellectual property, and food/perishable supply chains. Besides systematically mapping the literature, we identify several research gaps and propose numerous actionable research directions for the future. This study enriches the extant blockchain literature, provides a timely snapshot of the current state of research, and examines the knowledge structure of blockchain research in logistics and SCM with the help of evidence-based scientometric methods."
2021-08-01,AI applications of data sharing in agriculture 4.0: A framework for role-based data access control,10.1016/j.ijinfomgt.2021.102350,"[{'author_name': 'Konstantina Spanaki', 'author_slug': 'konstantina-spanaki-OjAAjP', 'author_sequence_number': '1', 'affiliation': None, 'affiliation_slug': None}, {'author_name': 'Erisa Karafili', 'author_slug': 'erisa-karafili-LDl5jP', 'author_sequence_number': '2', 'affiliation': None, 'affiliation_slug': None}, {'author_name': 'Stella Despoudi', 'author_slug': 'stella-despoudi-5m4eA', 'author_sequence_number': '3', 'affiliation': None, 'affiliation_slug': None}]",International Journal of Information Management,International Journal of Information Management,59,2021,Elsevier BV,,102350,
2018-08-30,Logistics Services Sector and Economic Recession in Greece: Challenges and Opportunities,10.3390/logistics2030016,"[{'author_name': 'Dimitris Folinas', 'author_slug': 'dimitris-folinas-1gZ29X', 'author_sequence_number': '1', 'affiliation': None, 'affiliation_slug': None}, {'author_name': 'Naoum Tsolakis', 'author_slug': 'naoum-tsolakis-2NKblm', 'author_sequence_number': '2', 'affiliation': None, 'affiliation_slug': None}, {'author_name': 'Dimitrios Aidonis', 'author_slug': 'dimitrios-aidonis-1ggwEX', 'author_sequence_number': '3', 'affiliation': None, 'affiliation_slug': None}]",Logistics,Logistics,2,2018,MDPI AG,3,16,"Abstract:The recent economic recession in Greece has had a detrimental impact on all national business activities, with the logistics industry being one of the most affected sectors primarily due to the significant decrease in market demand for goods and services. In this regard, the aim of this research is to identify key challenges and prospects for the Greek logistics services industry stemming from the recent economic crisis era through a critical literature taxonomy, a semantic analysis of the reviewed articles, and a questionnaire-based survey involving 140 executives from the third-party logistics sector. In principal, the recent economic crisis is reported to have significantly affected logistics service providers, thus further imposing structural reforms in the industry. The reduction in operating profits of transport companies is noticeable with the onset of the economic crisis, specifically in 2016. Nevertheless, logistics executives are optimistic regarding the near future, provided that educated and informed strategic management decisions are made and inventive business practices are embraced."
2022-07-11,The Role of Supply Chain Resilience on SMEs’ Performance: The Case of an Emerging Economy,10.3390/logistics6030047,"[{'author_name': 'Mohammed Awad Alshahrani', 'author_slug': 'mohammed-awad-alshahrani-rQglYQ', 'author_sequence_number': '1', 'affiliation': None, 'affiliation_slug': None}, {'author_name': 'Mohammad Asif Salam', 'author_slug': 'mohammad-asif-salam-2NVMQL', 'author_sequence_number': '2', 'affiliation': None, 'affiliation_slug': None}]",Logistics,Logistics,6,2022,MDPI AG,3,47,"Existing studies have predominantly explored the influence of supply chain resilience on the performance of firms in the context of developed economies. This study highlights the need for SMEs to be prepared to tackle uncertainties in business operations. Background: Small and Medium Enterprises (SMEs) play a critical role in every economy, and limited studies have highlighted the significance of resilience in the firms. Therefore, this study aims to determine the impact of supply chain resilience on SMEs’ performance in Saudi Arabia based on three dimensions of resilience, namely agility, robustness, and flexibility. It aims to investigate how they relate to the dimensions of SMEs’ performance, namely production performance and market/sales performance. This study also investigates the overall impact of supply chain resilience as a construct on SMEs’ performance. Methods: This study employed a quantitative research design to answer the research questions. A self-administered questionnaire was used to collect data. The study was based on 255 samples of managers in SMEs from Saudi Arabia. The hypothesized model has been tested using the SPSS/Amos 26. Results: Based on the findings, it has been found that supply chain agility and flexibility had a significant positive relationship with SMEs’ production and marketing/sales performances. Supply chain robustness demonstrated a significant positive relationship with SMEs’ production performance but not their marketing/sales performances. Overall, there was a significant positive relationship between supply chain resilience and SMEs’ performance. Conclusions: This study contributes to the body of literature on supply chain resilience by expounding knowledge on aspects such as agility, flexibility, and robustness. The study enhances our understanding of the role of supply chain resilience on SMEs’ performance in an emerging economy context."
2022-07-12,Adoption and Influence of Robotic Process Automation in Beef Supply Chains,10.3390/logistics6030048,"[{'author_name': 'Khushboo E-Fatima', 'author_slug': 'khushboo-e-fatima-v9vYa4', 'author_sequence_number': '1', 'affiliation': None, 'affiliation_slug': None}, {'author_name': 'Rasoul Khandan', 'author_slug': 'rasoul-khandan-zbRZWb', 'author_sequence_number': '2', 'affiliation': None, 'affiliation_slug': None}, {'author_name': 'Amin Hosseinian-Far', 'author_slug': 'amin-hosseinian-far-zRMPPb', 'author_sequence_number': '3', 'affiliation': None, 'affiliation_slug': None}, {'author_name': 'Dilshad Sarwar', 'author_slug': 'dilshad-sarwar-6ML4g', 'author_sequence_number': '4', 'affiliation': None, 'affiliation_slug': None}, {'author_name': 'Hareer Fatima Ahmed', 'author_slug': 'hareer-fatima-ahmed-Mz8zmY', 'author_sequence_number': '5', 'affiliation': None, 'affiliation_slug': None}]",Logistics,Logistics,6,2022,MDPI AG,3,48,"This paper aims to critically examine the potential barriers to the implementation and adoption of Robotic Process Automation (RPA) in the beef supply chain. The beef supply chain has been challenging due to its complex processes, activities, and management. The beef industry has relied heavily on the human workforce in the past; however, RPA adoption allows automating tasks that are repetitive and strenuous in nature to enhance beef quality, safety and security. There are considerable potential barriers to RPA adoption as organisations have not focused on trying to eliminate them due to various reasons. Previous studies lack knowledge related to potential barriers to RPA adoption, so this creates a research gap and requires attention. Statistical data and information are extracted using secondary data relevant to RPA adoption in the beef supply chain. A business process model is formed which uses values or variables using existing statistical data and information. Simulation of the process model is carried out using Simul8 software and analyses of different scenarios help in choosing the best approach for RPA adoption. Results have identified the potential barriers in RPA adoption through the simulation process thus ensuring RPA performs with more potential. Analysis of ‘what-if’ scenarios allows organizational and employee-level improvements along with enhancing RPA’s accuracy. The process model is a generic model for use in real-life scenarios and can be modified by organisations according to their own business needs and requirements. The study contributes in theoretical and practical aspects as it allows decision-makers and managers to adopt RPA in a robust manner and adds to scientific knowledge by identification of potential barriers to RPA adoption."
